text,confluence_url
"Выбор спортивных секций по Физической культуре будет проходить в ИС Модеус во вкладке ""Выбор модулей"".  Вам нужно будет выбрать 2 интересующие Вас спортивные секции, которые будут проходить каждую неделю в одно и то же время.  Ограничения: 1) Записаться можно не более чем на 2 занятия в неделю 2) Нельзя записываться на два занятия подряд.  Вас могут не допустить на занятие, если Вы были на предыдущей паре и/или уже посетили два занятия за неделю. При этом расписание на наличие конфликтов Вы проверяете самостоятельно в соответствии с Вашим расписанием в ИС Модеус и расписанием спортивных секций (во вложенных файлах). Ваш выбор пролонгируется до конца семестра, однако в любой момент Вы можете его изменить, отписавшись от одной секции и записавшись на другую. ВАЖНО!  Студент, пропустивший два занятия подряд, будет отписан автоматически. Выбор Физической культуры откроется 06.09.2023 и будет открыт до конца семестра.  Для успешной аттестации по дисциплине «Физическая культура: элективные курсы по видам спорта» Вы должны набрать не менее 61 балла по балльно-рейтинговой оценочной шкале. Для этого Вы можете: 1) Посещать академические занятия (3 балла за каждое занятие); 2) Принять участие в спортивно-массовых мероприятиях университета: Днях здорового образа жизни, Маршрут Дружбы, Кросс Наций, и других (0-10 баллов за каждое мероприятие). 3) Принять участите в соревнованиях по видам спорта (0 – 60 баллов); 4) Выполнить ВФСК ГТО (0 – 60 баллов). Для оформления посещения частного фитнес-клуба или тренажёрного зала вместо практических занятий по физкультуре студент к первому занятию по физической культуре представляет тренеру-преподавателю по спорту (куратору по физкультуре)  пакет документов  и приходит на зачётное мероприятие. ВАЖНО!!!  Все документы должны быть предоставлены в течение первой учебной недели. Список ответственных за прием документов спортзала по институтам (Ленина, 6):  1. ИГиП, Антропошкола – Пырлич Юлия Васильевна (y.v.pyrlich@utmn.ru) 2. СоцГум- Ерженин Владимир Сергеевич (v.s.erzhenin@utmn.ru) 3. ФЭИ - Копякова Анна Леонидовна (a.l.kopyakova@utmn.ru) 4. ИнЗем  - Питулин Артём Владимирович (a.v.pitulin@utmn.ru) 5. ФТИ, ИнХим, ШЕН –Пырлич Юлия Васильевна (y.v.pyrlich@utmn.ru) 6. ИнБио - Криводанова Наталья Александровна (n.a.krivodanova@utmn.ru) 7. Школа образования - Баянов Николай Ильич (n.i.bayanov@utmn.ru) 8. ШКН - Тверских Владислав Владимирович (vl.v.tverskikh@utmn.ru)",https://confluence.utmn.ru/pages/viewpage.action?pageId=86479056
"Я согласен (а) на переаттестацию дисциплин (ы), изученных (ной) мною 
ранее, указ анных (ной) в учебной кар точке/справке о периоде  
обучения  __________________, __________ _____ __________ _. 
                                  (да/нет)                           (подпись обучающегося)  
 
Я уведомлен  (а) о том, что до выхода приказа о переводе являюсь 
обучающимся того направления подготовки (специальности), профиля 
(специализации, магистерской программы), формы обучения, на которой 
числюсь, и обязан выполнять все обязательства, касающиеся образовательно го 
процесса, в том числе в части оплаты обучения в случае обучения на мест е по 
договору об оказании платных образовательных услуг  _____________ ____ ___. 
                                                                                                                  (подпись обучающегося)  
 
Я уведомлен о том, что в  соответствии с требованиями ФГОС ВО  
при возникновении превышения допустимых норм в части объема программы  
по количеству зачетных единиц  за один учебный год, согласен  (а) перевод  
с понижением курс а (ов) _____________ _____ ___. 
                                                     (подпись обучающегося)  
 
Отношусь к малочисленным народам севера  ____________________________ . 
                                                                                                    (да/нет)  
 
Отношус ь к льготным категориям граждан 
________________________________________________ ____________________  
(к детям -сиротам и детям, оставшимися без попечения родителей, или к лицам из их числа;  
к лицам, потерявшим в период обучения обоих родителей или единственного родителя;  
к детям -инвалидам, инвалидам I и II групп, инвалидам с детства; обучающемуся, получавшему 
государственную социальную помощь ; обучающемуся, подвергшегося воздействию радиации 
вследствие катастрофы на Чернобыльской АЭС и иных радиационных катастроф, вследствие 
ядерных испытаний на Семипалатинском полигоне; обучающемуся, являющимся инвалидом 
вследствие военной травмы или заболева ния, полученных в период прохождения военной 
службы; ветеранам боевых действий; обучающемуся в возрасте до 20 лет, у которого 
единственный родитель является инвалидом I группы)  
 
 
ФИО (указать полностью) ___________ Подпись обучающегося _____________  
 
Налич ие вакантных мест (количество) ________  
Увеличение периода обучения на 1 год (да/нет)  
Подпись, дата",https://confluence.utmn.ru/pages/viewpage.action?pageId=86479039&preview=%2F86479039%2F86479060%2FPoryadok_perevoda_obuchayuschixsya_VO.pdf
"Прежде, чем выбрать элективы, рекомендуем почитать отзывы на сервисе «Отзывус»:  https://electives.utmn.ru . Там же можно написать о своём опыте изучения элективных дисциплин. Информация, о том, как поменять электив, отправляется на корпоративную почту в первую учебную неделю семестра.",https://confluence.utmn.ru/pages/viewpage.action?pageId=86479065
На данной странице вы можете ознакомиться с регламентами дисциплин ядерной программы: История России Реализация Об утверждении Регламент… Принципы естественнонаучного познания Реализация Об утверждении Регламент… Проектно-исследовательская работа и  Реализация Об утверждении Регламент… Аттестация (+ цифровая культура) Об утверждении Регламент… Россия и мир Реализация Об утверждении Регламент… Философия: технологии мышления Аттестация Об утверждении Регламент… Аналитическое чтение Аттестация Об утверждении Регламент… Аналитическая систематика Реализация Об утверждении Регламент… Математика Аттестация Об утверждении Регламент… Дискретная математика Аттестация Об утверждении Регламент… Математический анализ Аттестация Об утверждении Регламент… Алгебра Аттестация Об утверждении Регламент… Основы программирования Аттестация Об утверждении Регламент… Программирование и основы алгоритмизации Аттестация Об утверждении Регламент… Базы данных Аттестация Об утверждении Регламент… Иностранный язык Аттестация Об утверждении Регламент…,https://confluence.utmn.ru/pages/viewpage.action?pageId=86479068
В Тюменском государственном университете представлены Honors-треки: Спортивное программирование Капитаны Школа естественных наук Интеграция Нетология С подробностями вы можете ознакомиться в презентации: Honors-треки.pdf,https://confluence.utmn.ru/pages/viewpage.action?pageId=86479082
"Если Вы являетесь студентом ТюмГУ, то для получения документов (аттестата, диплома) из личного дела Вам необходимо обратиться в Единый деканат. Запрос обрабатывается до пяти рабочих дней. Если Вы были отчислены или являетесь выпускником, то для получения документов из личного дела Вам необходимо направить запрос на выдачу документов из архивного фонда ТюмГУ на почту  common@utmn.ru Бланк запроса Вы можете скачать по ссылке   https://www.utmn.ru/o-tyumgu/organizatsionnaya-skhema-tyumgu/upravlenie-po-rabote-s-personalom/struktura/sluzhba-dokumentatsionnogo-obespecheniya/blanki-zayavleniy/",https://confluence.utmn.ru/pages/viewpage.action?pageId=108233001
"Заявление о переводе на бюджет подается в личном кабинете на портале ""Вместе"" в определенные сроки и формируется автоматически при заполнении всех соответствующих полей. Сроки подачи заявления и порядок перевода доступны по ссылке  https://www.utmn.ru/studentam/perevod-na-byudzhet/poryadok-perevoda/ Polozhenie-o-perekhode-o…",https://confluence.utmn.ru/pages/viewpage.action?pageId=108233005
"Изменение перечня выбранных элективов после окончания периода выбора возможно в течение первой недели реализации элективных дисциплин (до второй учебной встречи) при наличии вакантных мест на реализуемых элективах и отсутствии конфликтов в расписании обучающегося. Перевод обучающегося  очной и очной-заочной форм  обучения из одной группы (подгруппы) в другую при наличии свободных мест осуществляется в течение первых двух недель в начале семестра в соответствии с календарным учебным графиком. Перевод обучающегося  заочной формы  обучения из одной группы (подгруппы) в другую при наличии свободных мест осуществляется не позднее, чем за одну неделю до начала учебно-экзаменационной сессии в соответствии с календарным учебным графиком.",https://confluence.utmn.ru/pages/viewpage.action?pageId=108233007
"Пересдача может быть произведена только на последнем курсе обучения и только для получения диплома с отличием. Пересдать можно одну оценку «удовлетворительно», если она является единственной, или оценку «хорошо» при отсутствии оценок «удовлетворительно». Не допускается пересдача практик и курсовых работ. Студент может подать заявление в Едином деканате после прохождения промежуточной аттестации. Если в семестре предусмотрено только прохождение практики, то заявление подается в первые 2 (две) недели от начала семестра (триместра, модуля). Пересдача может быть назначена только до подписания приказа о допуске к государственной итоговой аттестации. Диплом с отличием выдается при следующих условиях: -    все указанные в приложении к диплому оценки по дисциплинам (модулям), практикам, курсовым работам (проектам) являются оценками “отлично” и “хорошо” -    все оценки по результатам государственной итоговой аттестации – “отлично” -    количество указанных в приложении к диплому оценок “отлично”, включая оценки по ГИА, составляет не менее 75%.",https://confluence.utmn.ru/pages/viewpage.action?pageId=108233009
"При несогласии с результатами промежуточной аттестации или первой повторной промежуточной аттестации по учебному предмету, дисциплине, модулю, практике обучающийся имеет право подать апелляцию. Апелляцию можно подать лично в Едином деканате либо посредством электронной корпоративной почты. Если это дисциплина общеобразовательного блока, то апелляция подается в Управление индивидуальных образовательных траекторий. Апелляция по устному экзамену (зачету), практике подается в день его сдачи, защиты отчета о результатах практики; по письменному – в день объявления оценки. В случае завершения экзамена (зачета) после 18:00 в соответствии с расписанием, апелляция может быть подана на следующий день. Оценка, выставленная экзаменационной комиссией по итогам второй повторной промежуточной аттестации (комиссионной пересдачи) является окончательной, апелляции не принимаются.",https://confluence.utmn.ru/pages/viewpage.action?pageId=108233012
"Студент имеет право подать апелляцию о нарушении, по его мнению, установленной процедуры проведения государственного аттестационного испытания и (или) несогласии с результатами государственного экзамена. Апелляция подается студентом лично в Службу документационного обеспечения (ул. Володарского, д.6, каб.111) не позднее следующего рабочего дня после объявления результатов государственного аттестационного испытания.",https://confluence.utmn.ru/pages/viewpage.action?pageId=108233014
"Перезачет – это процедура аттестации с целью признания в полном объеме результатов освоения дисциплин (иных видов учебных работ), пройденных студентом в университете или в других образовательных организациях, полностью освобождающая его от необходимости повторного освоения дисциплины (иных видов учебных работ) и прохождения по ним промежуточной аттестации. Подать заявление о перезачете дисциплины  с предоставлением подтверждающего документа  можно не позднее, чем за три недели до начала промежуточной аттестации по данной дисциплине лично в Едином деканате или дистанционно, направив документы на электронную почту  ed@utmn.ru Бланк заявления доступен по ссылке  https://www.utmn.ru/o-tyumgu/organizatsionnaya-skhema-tyumgu/edinyy-dekanat/blanki-zayavleniy/inye-zayavleniya/ Обращаем внимание!  Для  студента высшего образования из диплома о среднем профессиональном образовании разрешается перезачет только дисциплин по физической культуре и спорту. Polozhenie-ob-attestatsi…",https://confluence.utmn.ru/pages/viewpage.action?pageId=108233017
"Обучающийся, имеющий уважительную причину отсутствия на экзамене (зачете), подтвержденную документально, обязан любым доступным для него способом (корпоративная электронная почта, телефон, почтовое письмо) сообщить об этом в Единый деканат в течение 5 (пяти) рабочих дней с момента возникновения причины и подать заявление с подтверждающим документом в течение  3 (трех) рабочих дней с момента их получения (закрытия). Медицинский документ, представленный обучающимся после получения неудовлетворительной оценки на экзамене (зачете), к рассмотрению не принимается. Иные уважительные причины (смерть близкого родственника, природная катастрофа или стихийное бедствие, повестка для явки в суд или в правоохранительные органы) подтверждаются документально не позднее трех рабочих дней после неявки. К уважительным причинам не относится отсутствие обучающегося на экзамене (зачете), вызванное обстоятельствами, связанными с работой обучающегося (служебная командировка и т.п.), за исключением служащих в силовых ведомствах. Если документ, представленный обучающимся и подтверждающий уважительную причину отсутствия, является подложным, результаты промежуточной аттестации аннулируются, и обучающийся отчисляется из Университета. Заявление о переносе сроков промежуточной аттестации можно скачать по ссылке  https://www.utmn.ru/o-tyumgu/organizatsionnaya-skhema-tyumgu/edinyy-dekanat/blanki-zayavleniy/inye-zayavleniya/",https://confluence.utmn.ru/pages/viewpage.action?pageId=108233022
"Студент, не прошедший государственную итоговую аттестацию в связи с неявкой по уважительной причине, подтвержденной документально, вправе пройти ее в течение 6 месяцев после завершения ГИА без отчисления из вуза. Обучающийся, не прошедший один государственный экзамен по уважительной причине, допускается к сдаче следующего государственного экзамена (при его наличии), но не допускается к защите ВКР. Медицинский документ о болезни, представленный обучающимся после получения неудовлетворительной оценки на государственном аттестационном испытании, к рассмотрению не принимается. Заявление о переносе сроков государственной итоговой аттестации можно скачать по ссылке  https://www.utmn.ru/o-tyumgu/organizatsionnaya-skhema-tyumgu/edinyy-dekanat/blanki-zayavleniy/inye-zayavleniya/",https://confluence.utmn.ru/pages/viewpage.action?pageId=108233024
